site,lat,lng,zip,name,address,phone,email,web
"brunningandprice","","","BA1 1LP","The Architect","The Empire, Orange Grove, Bath, Somerset, BA1 1LP","01225 439 610","","http://www.thearchitectbath.co.uk"
"brunningandprice","","","CH1 2NX","The Architect","54 Nicholas Street, Chester, Cheshire, CH1 2NX","01244 353 070","","http://www.architect-chester.co.uk"
"brunningandprice","","","SY1 1HH","The Armoury","Victoria Quay, Victoria Avenue, Shrewsbury, Shropshire, SY1 1HH","01743 340 525","","http://www.armoury-shrewsbury.co.uk"
"brunningandprice","","","B49 5NL","Arrow Mill","Arrow, Near Alcester, Warwickshire, B49 5NL","01789 333790","","http://www.thearrowmill.co.uk"
"brunningandprice","","","BB7 9PQ","The Aspinall Arms","Mitton Rd, Mitton, Clitheroe, Lancashire, BB7 9PQ","01254 826 555","","http://www.aspinallarmspub.co.uk"
"brunningandprice","","","CV37 8NY","The Bell","Alderminster, Stratford-upon-Avon, CV37 8NY","01789 335 671","","http://www.bellalderminster.co.uk"
"brunningandprice","","","RH12 1RJ","The Black Jug","31 North Street, Horsham, West Sussex, RH12 1RJ","01403 253 526","","http://www.blackjug-horsham.co.uk"
"brunningandprice","","","RH17 5RL","The Bolney Stage","London Road, Bolney Village, West Sussex, RH17 5RL","01444 881 200","","http://www.bolneystage.co.uk"
"brunningandprice","","","BD23 3AE","The Bull","Broughton, Skipton, Yorkshire, BD23 3AE","01756 792 065","","http://www.thebullatbroughton.com"
"brunningandprice","","","SK10 4QH","The Bull's Head","Wilmslow Road, Mottram St Andrew, Cheshire, SK10 4QH","01625 828 111","","http://www.bullshead-mottram.co.uk"
"brunningandprice","","","BB2 6QB","The Clog & Billycock","Billinge End Road, Pleasington, Blackburn, BB2 6QB","01254 201 163","","http://www.clogandbillycock.co.uk"
"brunningandprice","","","SW7 4PL","Coco Momo","25 Gloucester Rd, South Kensington, SW7 4PL","020 3985 9415","","http://www.cocomomo.co.uk"
"brunningandprice","","","SY13 4AT","The Combermere Arms","Burleydam, Whitchurch, Shropshire, SY13 4AT","01948 871 223","","http://www.combermerearms.co.uk"
"brunningandprice","","","LL20 8PN","The Corn Mill",">Dee Lane, Llangollen, Denbighshire, LL20 8PN","01978 869 555","","http://www.cornmill-llangollen.co.uk"
"brunningandprice","","","B95 5EE","The Crabmill","Warwick Rd, Henley-in-Arden, Warwickshire, B95 5EE","TBC","","http://www.crabmillpub.co.uk"
"brunningandprice","","","WD3 6AS","The Cricketers","The Green, Sarratt, Hertfordshire, WD3 6AS","01923 270 877","","http://www.cricketers-sarratt.co.uk"
"brunningandprice","","","LL13 0DR","The Cross Foxes","Erbistock, Wrexham, LL13 0DR","01978 780 380","","http://www.crossfoxes-erbistock.co.uk"
"brunningandprice","","","LL16 4DA","The Dinorben Arms","Bodfari, Denbighshire, LL16 4DA","01745 775 090","","http://www.dinorbenarms.co.uk"
"brunningandprice","","","EN5 4SG","The Duke of York","Ganwick Corner, Barnet Road, Barnet, Hertfordshire, EN5 4SG","020 8440 4674","","http://www.dukeofyork-barnet.co.uk"
"brunningandprice","","","CW6 9PH","The Dysart Arms","Bowes Gate Road, Bunbury, Near Tarporley, Cheshire, CW6 9PH","01829 260183","","http://www.dysartarms-bunbury.co.uk"
"brunningandprice","","","OX17 1JJ","The Falcon at Warmington","Warwick Road, Warmington, Banbury, Warwickshire, OX17 1JJ","01295 692 120","","http://www.falconatwarmington.co.uk"
"brunningandprice","","","TF10 9LQ","The Fox","Pave Lane, Chetwynd Aston, Newport, Shropshire, TF10 9LQ","01952 815 940","","http://www.fox-newport.co.uk"
"brunningandprice","","","RH6 0ET","The Fox Revived","Norwood Hill, Horley, Surrey, RH6 0ET","01293 229 270","","http://www.foxrevived.co.uk"
"brunningandprice","","","CT2 0DB","The George & Dragon","King Street, Fordwich , Canterbury, Kent, CT2 0DB","01227 710 661","","http://www.georgeanddragon.pub"
"brunningandprice","","","CH7 6LR","Glasfryn","Raikes Lane, Sychdyn, Mold, Flintshire, CH7 6LR","01352 750500","","http://www.glasfryn-mold.co.uk"
"brunningandprice","","","OX13 5PX","The Greyhound","Besselsleigh, Nr Abingdon, Oxford, Oxfordshire, OX13 5PX","01865 862 110","","http://www.greyhound-besselsleigh.co.uk"
"brunningandprice","","","CH3 6HJ","The Grosvenor Arms","Chester Road, Aldford, Chester, Cheshire, CH3 6HJ","01244 620 228","","http://www.grosvenorarms-aldford.co.uk"
"brunningandprice","","","PR2 5SQ","Haighton Manor","Haighton Green Lane, Haighton, Preston, Lancashire, PR2 5SQ","01772 706 350","","http://www.haightonmanorpub.co.uk"
"brunningandprice","","","CW3 9BJ","The Hand & Trumpet","Main Road, Wrinehill, Crewe, CW3 9BJ","01270 820 048","","http://www.handandtrumpet.co.uk"
"brunningandprice","","","TN3 0JA","The Hare","Langton Road, Langton Green, Tunbridge Wells, Kent, TN3 0JA","01892 862 419","","http://www.hare-tunbridgewells.co.uk"
"brunningandprice","","","RH8 9PE","The Haycutter","TTanhouse Road, Oxted, Surrey, RH8 9PE","01883 776 955","","http://www.haycutter.co.uk"
"brunningandprice","","","CW10 9JP","The Hayhurst Arms","Bostock Green, Nr Northwich, Cheshire, CW10 9JP","01606 541 810","","http://www.hayhurstarms.co.uk"
"brunningandprice","","","BN12 6FB","The Highdown","Littlehampton Rd, Goring-by-Sea, West Sussex, BN12 6FB","01903 924 670","","http://www.thehighdown.co.uk"
"brunningandprice","","","LA6 2RJ","The Highwayman","Burrow, Kirkby Lonsdale, Lancashire, LA6 2RJ","01524 273 338","","http://www.highwaymaninn.co.uk"
"brunningandprice","","","RG10 9SB","The Horse & Groom","Bath Road, Hare Hatch, Twyford, Berkshire, RG10 9SB","0118 940 3136","","http://www.horseandgroom-harehatch.co.uk"
"brunningandprice","","","WV6 7EQ","The Inn at Shipley","Bridgnorth Rd, Shipley, Nr Wolverhampton , Shropshire, WV6 7EQ","01902 701 639","","http://www.innatshipley.co.uk"
"brunningandprice","","","RG27 8JU","The Leather Bottle","Reading Road, Mattingley, Hook, Hampshire, RG27 8JU","01189 326 371","","http://www.leatherbottle-mattingley.co.uk"
"brunningandprice","","","WA4 2SX","Little Manor","Bell Lane, Thelwall, Warrington, Cheshire, WA4 2SX","01925 212 070","","http://www.littlemanor-thelwall.co.uk"
"brunningandprice","","","B90 1QZ","The Mallard","Tidbury Green Farm, Tidbury Green, Earlswood, Solihull, B90 1QZ","TBC","","http://www.mallardpub.co.uk"
"brunningandprice","","","RG29 1ET","The Mill House","North Warnborough, Odiham, Hampshire, RG29 1ET","01256 702 953","","http://www.millhouse-hook.co.uk"
"brunningandprice","","","CW6 0RZ","The Morris Dancer","Chester Road, Kelsall, Tarporley, Cheshire, CW6 0RZ","01829 701 680","","http://www.morrisdancer.pub"
"brunningandprice","","","KT8 9BN","The Mute Swan","3 Palace Gate, Hampton Court, Surrey, KT8 9BN","020 8941 5959","","http://www.muteswan.co.uk"
"brunningandprice","","","SY5 6QG","The Mytton and Mermaid","Atcham, Shrewsbury, SY5 6QG","TBC","","http://www.myttonandmermaid.co.uk"
"brunningandprice","","","HG3 2BU","The Nelson Inn","Skipton Road, Harrogate, HG3 2BU","01423 803 620","","http://www.nelsoninn.co.uk"
"brunningandprice","","","TN3 9JR","The Nevill Crest & Gun","Eridge Road, Eridge Green, Tunbridge Wells, East Sussex, TN3 9JR","01892 864209","","http://www.nevillcrestandgun.co.uk"
"brunningandprice","","","ST19 9BH","The Oakley Arms","Kiddemore Green Road, Brewood, Staffordshire, ST19 9BH","01902 859 800","","http://www.oakleyarms.co.uk"
"brunningandprice","","","GL50 1ND","The Old Courthouse","County Court Road, Cheltenham, Gloucestershire, GL50 1ND","01242 500 930","","http://www.oldcourthouse.pub"
"brunningandprice","","","CW11 1AL","Old Hall","High Street, Sandbach, Cheshire, CW11 1AL","01270 758 170","","http://www.oldhall-sandbach.co.uk"
"brunningandprice","","","CH3 5AL","The Old Harkers Arms","1 Russell Street, Chester, Cheshire, CH3 5AL","01244 344 525","","http://www.harkersarms.co.uk"
"brunningandprice","","","UB9 6HJ","The Old Orchard","Park Lane, Harefield, Uxbridge, Middlesex, UB9 6HJ","01895 822 631","","http://www.oldorchard-harefield.co.uk"
"brunningandprice","","","CM3 8HT","The Old Windmill","South Hanningfield Road, South Hanningfield, Nr. Chelmsford, Essex, CM3 8HT","01268 712 280","","http://www.oldwindmillpub.co.uk"
"brunningandprice","","","RG4 7UG","The Packhorse","Woodcote Road, Chazey Heath, Mapledurham, Reading, RG4 7UG","0118 972 2140","","http://www.packhorsepub.co.uk"
"brunningandprice","","","LL12 8TY","The Pant-yr-Ochain","Old Wrexham Road, Gresford, Wrexham, LL12 8TY","01978 853 525","","http://www.pantyrochain-gresford.co.uk"
"brunningandprice","","","RH5 5RZ","The Parrot","Horsham Road, Forest Green, Surrey, RH5 5RZ","01306 775 790","","http://www.theparrot.co.uk"
"brunningandprice","","","LL29 6DD","Pen-y-Bryn","Pen-y-Bryn Road, Upper Colwyn Bay, Conwy, LL29 6DD","01492 533 360","","http://www.penybryn-colwynbay.co.uk"
"brunningandprice","","","RH3 7BG","The Pheasant at Buckland","Reigate Road, Buckland, Betchworth, Surrey, RH3 7BG","01737 221 355","","http://www.pheasantatbuckland.co.uk"
"brunningandprice","","","B15 3DH","The Physician","Harborne Road, Edgbaston, Birmingham, B15 3DH","0121 272 5900","","http://www.thephysician.co.uk"
"brunningandprice","","","WR13 6NY","The Plough and Harrow","Rhydd Rd, Guarlford, Malvern, WR13 6NY","01684 218 410","","http://www.ploughandharrowpub.co.uk"
"brunningandprice","","","AL3 6JZ","The Prae Wood Arms","Garden House Lane, St Albans, Hertfordshire, AL3 6JZ","01727 229090","","http://www.praewoodarms.co.uk"
"brunningandprice","","","N8 9DE","The Queens","26 Broadway Parade, Crouch End, N8 9DE","020 3978 2154","","http://www.thequeenscrouchend.co.uk"
"brunningandprice","","","SW1V 1QT","The Queens Arms","11 Warwick Way, Pimlico, SW1V 1QT","020 3985 9446","","http://www.thequeensarmspimlico.co.uk"
"brunningandprice","","","CH2 4HS","Rake Hall","Rake Lane, Little Stanney, Chester, CH2 4HS","01244 257 482","","http://www.rakehall.co.uk"
"brunningandprice","","","CH64 7TL","The Red Fox","Liverpool Rd, Thornton Hough, Wirral, Merseyside, CH64 7TL","0151 353 2920","","http://www.redfox.pub"
"brunningandprice","","","WS15 4QF","The Red Lion","Hay Lane, Longdon Green, Staffordshire, WS15 4QF","01543 490 410","","http://www.redlion-longdon.co.uk"
"brunningandprice","","","GU8 5HJ","The Refectory","Portsmouth Road, Milford, Godalming, Surrey, GU8 5HJ","01483 413 820","","http://www.refectory-godalming.co.uk"
"brunningandprice","","","DY7 5QJ","The Roe Deer","Wordsley, Stourbridge, West Midlands, DY7 5QJ","01384 958 640","","http://www.roedeerpub.co.uk"
"brunningandprice","","","W4 1PU","The Roebuck","122 High Road, Chiswick, W4 1PU","020 3978 2162","","http://www.theroebuckchiswick.co.uk"
"brunningandprice","","","RG7 5SH","The Rowbarge","Station Road, Woolhampton, Berkshire, RG7 5SH","01189 712 213","","http://www.rowbarge-woolhampton.co.uk"
"brunningandprice","","","L37 0AB","The Sparrowhawk","Southport Old Rd, Formby, Merseyside, L37 0AB","01704 882 350","","http://www.sparrowhawk-formby.co.uk"
"brunningandprice","","","W4 3PU","The Steam Packet","85 Strand-On-The-Green, Chiswick, W4 3PU","020 3994 8140","","http://www.steampacketpub.co.uk"
"brunningandprice","","","SK11 0HE","Sutton Hall","Bullocks Lane, Sutton, Macclesfield, SK11 0HE","01260 253 211","","http://www.suttonhall.co.uk"
"brunningandprice","","","RG27 0RR","The Tally Ho","Fleet Hill, Eversley, Hampshire, RG27 0RR","0118 973 2134","","http://www.tallyho-eversley.co.uk"
"brunningandprice","","","SW15 3TU","The Telegraph","Putney Heath, Putney, London, SW15 3TU","020 8194 2808","","http://www.telegraphputney.co.uk"
"brunningandprice","","","IG7 6ET","The Two Brewers","57 Lambourne Road, Chigwell Row, Chigwell, Essex, IG7 6ET","020 8501 1313","","http://www.twobrewers.pub"
"brunningandprice","","","M15 4ST","The Wharf","6 Slate Wharf, Castlefield, Manchester, M15 4ST","0161 507 4240","","http://www.thewharf-castlefield.co.uk"
"brunningandprice","","","SO40 2NP","The White Hart","Old Romsey Road, Cadnam, Hampshire, SO40 2NP","02380 812 277","","http://www.whitehart-cadnam.co.uk"
"brunningandprice","","","CR5 3QW","The White Hart","Hazelwood Lane, Chipstead, Surrey, CR5 3QW","01737 554 455","","http://www.whitehart-chipstead.co.uk"
"brunningandprice","","","GU24 8AA","The White Hart","High Street, Chobham, Surrey, GU24 8AA","01276 857580","","http://www.whitehartchobham.co.uk"
"brunningandprice","","","TN13 1SG","The White Hart","Tonbridge Road, Sevenoaks, Kent, TN13 1SG","01732 452 022","","http://www.whitehart-sevenoaks.co.uk"
"brunningandprice","","","HP9 2JD","The White Horse","70 London End, Oxford Road, Beaconsfield, Buckinghamshire, HP9 2JD","01494 360 000","","http://www.whitehorsebeaconsfield.co.uk"
"brunningandprice","","","TF8 7JF","The Woodbridge Inn","Coalport, Telford, Shropshire, TF8 7JF","01952 882 054","","http://www.woodbridge-coalport.co.uk"
"brunningandprice","","","M28 2QT","Worsley Old Hall","Walkden Road, Worsley, Greater Manchester, M28 2QT","0161 703 8706","","http://www.worsleyoldhall.co.uk"