url,total_reviews,review_id,user,user_review_count,review_date,review_rating,review_url,review_title,review_text,user_visited_date,user_location
"https://www.tripadvisor.co.uk/Restaurant_Review-g1443265-d21330904-Reviews-Bella_Italia-Whitfield_Dover_Kent_England.html","22","836021138","disneymagicv","","2022/04/25","1","https://www.tripadvisor.co.uk/ShowUserReviews-g1443265-d21330904-r836021138-Bella_Italia-Whitfield_Dover_Kent_England.html","The worst Bella italia I’ve ever been to.","Went here in a group of 9 for my grandads birthday. We waited 45 minutes for our main meal to even reach us, Bolognese was watery, the fungi mushroom pasta looked and tasted revolting. Don' even mention the deserts/ the brownie was gritty and powdery, the tiramisu was gritty anf left an awful residue in your mouth and the cookie with ice cream you couldn' even cut the cookie it was so hard. Don' eat here! Care to mention we didn' get one smile from any of the waiters! Poor service and food was awful!","April 2022",""
"https://www.tripadvisor.co.uk/Restaurant_Review-g1443265-d21330904-Reviews-Bella_Italia-Whitfield_Dover_Kent_England.html","22","832829048","667neilm","","2022/03/30","5","https://www.tripadvisor.co.uk/ShowUserReviews-g1443265-d21330904-r832829048-Bella_Italia-Whitfield_Dover_Kent_England.html","Staff exceptional","Went for a meal at the weekend , staff exceptional, took the vouchers without any hesitation. Food was hot and very tasty . The only little point was the coldness for which the restaurant manager did he best to overcome for us","March 2022","Whitfield, United Kingdom"
"https://www.tripadvisor.co.uk/Restaurant_Review-g1443265-d21330904-Reviews-Bella_Italia-Whitfield_Dover_Kent_England.html","22","829732550","lewseyd","","2022/03/01","5","https://www.tripadvisor.co.uk/ShowUserReviews-g1443265-d21330904-r829732550-Bella_Italia-Whitfield_Dover_Kent_England.html","Bottomless Pizza","Lovely meal and great service, Eliza was great as always. Highly recommend coming and the pizza is always tasty 😊","March 2022","Canterbury, United Kingdom"
"https://www.tripadvisor.co.uk/Restaurant_Review-g1443265-d21330904-Reviews-Bella_Italia-Whitfield_Dover_Kent_England.html","22","829438062","Kirsti E","","2022/02/27","3","https://www.tripadvisor.co.uk/ShowUserReviews-g1443265-d21330904-r829438062-Bella_Italia-Whitfield_Dover_Kent_England.html","Some good, some bad (greasy pizza!)","We visited this restaurant as a family on Friday evening. The restaurant was busy, and extremely loud - a lack of soft furnishings and the acoustics of the restaurant served like an echo chamber and we had to yell across the table to hear each...other. Two of us ordered pizza, and unfortunately it was very oily and greasy, not to the standard of a usual Bella Italia venue. - we have had the same experience before Christmas when we visited and had hoped it was a one-off, sadly it appears not. Other dishes were very tasty, so it's just the pizza that appears to need some attention. I must compliment the staff, they were lovely, polite and attentive, and the gelato sandwich we shared for a pudding was beautiful, so there was plenty of good stuff to mention. Unfortunately the pizza - which is obviously a staple of this type of restaurant - did let the evening down to the extent that we wouldn't be able to recommend the restaurant, a good pizza restaurant using a quality pizza oven should not be getting this wrong!","February 2022","Dover, United Kingdom"
"https://www.tripadvisor.co.uk/Restaurant_Review-g1443265-d21330904-Reviews-Bella_Italia-Whitfield_Dover_Kent_England.html","22","828442539","TheMorgos","","2022/02/18","1","https://www.tripadvisor.co.uk/ShowUserReviews-g1443265-d21330904-r828442539-Bella_Italia-Whitfield_Dover_Kent_England.html","Voucher refused","Downloaded voucher off of website before entering restaurant, showed voucher when ordering to which manager refused to accept. Manager abrupt and rude wouldn' go there again","February 2022","Dover, United Kingdom"
